"1","creed 2","La vie est devenue un numéro d'équilibriste pour Adonis Creed entre ses obligations personnelles et son entraînement pour son prochain grand match. Et l'enjeu du combat est d'autant plus élevé que son rival est lié au passé de sa famille. Mais il peut compter sur Rocky Balboa à ses côtés...
","2019","Steven Caple Jr","1"
"2","asterix - le secret de la potion magique","À la suite d’une chute lors de la cueillette du gui, le druide Panoramix décide qu’il est temps d’assurer l’avenir du village. Accompagné d’Astérix et Obélix, il entreprend de parcourir le monde gaulois à la recherche d’un jeune druide talentueux à qui transmettre le Secret de la Potion Magique…
","2018","Louis Clichy, Alexandre Astier","2"
"3","Tekken","Adaptation cinématographique du jeu de combat japonais ""Tekken"" centrée sur l'histoire de deux amis d'enfance qui défient les combattants des quatre coins du globe.
","2010","Dwight H. Little","3"
